<?xml version="1.0" encoding="UTF-8"?>
<Hotels xmlns:xsi="http://www.w3.org/2001/XMLSchema-instance"
        xsi:noNamespaceSchemaLocation="Hotels.xsd">

  <Hotel Rating="4.2">
    <Name>Westin</Name>
    <Phone>480-968-8885</Phone>
    <Phone>800-937-8461</Phone>
    <Address NearestAirport="Sky Harbor">
      <Number>11</Number>
      <Street>E 7th St</Street>
      <City>Tempe</City>
      <State>AZ</State>
      <Zip>85281</Zip>
    </Address>
  </Hotel>

  <Hotel Rating="4.0">
    <Name>Marriott Downtown</Name>
    <Phone>602-333-3333</Phone>
    <Address NearestAirport="Phoenix Sky Harbor">
      <Number>100</Number>
      <Street>E Adams St</Street>
      <City>Phoenix</City>
      <State>AZ</State>
      <Zip>85004</Zip>
    </Address>
  </Hotel>

  <Hotel Rating="3.8">
    <Name>Hyatt Place</Name>
    <Phone>480-222-1111</Phone>
    <Address>
      <Number>7300</Number>
      <Street>E 3rd Ave</Street>
      <City>Scottsdale</City>
      <State>AZ</State>
      <Zip>85251</Zip>
    </Address>
  </Hotel>

  <Hotel Rating="4.5">
    <Name>Hilton Garden Inn</Name>
    <Phone>480-555-9090</Phone>
    <Phone>877-555-0000</Phone>
    <Address NearestAirport="Mesa Gateway">
      <Number>4000</Number>
      <Street>S Rural Rd</Street>
      <City>Tempe</City>
      <State>AZ</State>
      <Zip>85282</Zip>
    </Address>
  </Hotel>

  <Hotel Rating="3.9">
    <Name>Holiday Inn Express</Name>
    <Phone>480-777-2323</Phone>
    <Address>
      <Number>1520</Number>
      <Street>S Price Rd</Street>
      <City>Chandler</City>
      <State>AZ</State>
      <Zip>85286</Zip>
    </Address>
  </Hotel>

  <Hotel Rating="4.1">
    <Name>Courtyard by Marriott</Name>
    <Phone>480-600-8888</Phone>
    <Address NearestAirport="Sky Harbor">
      <Number>202</Number>
      <Street>E University Dr</Street>
      <City>Tempe</City>
      <State>AZ</State>
      <Zip>85281</Zip>
    </Address>
  </Hotel>

  <Hotel Rating="4.4">
    <Name>Residence Inn</Name>
    <Phone>602-789-1111</Phone>
    <Address>
      <Number>601</Number>
      <Street>S Ash Ave</Street>
      <City>Tempe</City>
      <State>AZ</State>
      <Zip>85281</Zip>
    </Address>
  </Hotel>

  <Hotel Rating="3.6">
    <Name>Comfort Suites</Name>
    <Phone>480-606-3434</Phone>
    <Address>
      <Number>1625</Number>
      <Street>W Chandler Blvd</Street>
      <City>Chandler</City>
      <State>AZ</State>
      <Zip>85224</Zip>
    </Address>
  </Hotel>

  <Hotel Rating="4.3">
    <Name>Embassy Suites</Name>
    <Phone>480-222-8000</Phone>
    <Phone>800-222-8001</Phone>
    <Address NearestAirport="Sky Harbor">
      <Number>60</Number>
      <Street>E 5th St</Street>
      <City>Tempe</City>
      <State>AZ</State>
      <Zip>85281</Zip>
    </Address>
  </Hotel>

  <Hotel Rating="4.0">
    <Name>AC Hotel</Name>
    <Phone>602-700-9090</Phone>
    <Address>
      <Number>100</Number>
      <Street>E Rio Salado Pkwy</Street>
      <City>Tempe</City>
      <State>AZ</State>
      <Zip>85281</Zip>
    </Address>
  </Hotel>

  <Hotel Rating="3.7">
    <Name>Best Western Inn</Name>
    <Phone>480-900-4545</Phone>
    <Address NearestAirport="Mesa Gateway">
      <Number>1340</Number>
      <Street>W Baseline Rd</Street>
      <City>Mesa</City>
      <State>AZ</State>
      <Zip>85202</Zip>
    </Address>
  </Hotel>

</Hotels>
